{
  "schemaVersion": "1.0.0",
  "name": "mybun",
  "created": "2020-01-01T00:00:00Z",
  "modified": "2020-01-01T00:00:00Z",
  "parameters": [
    {
      "name": "verbose",
      "source": {
        "value": "6"
      }
    },
    {
      "name": "db-password",
      "source": {
        "secret": "mysql-password"
      }
    }
  ]
}