{
  "schemaVersion": "1.0.0",
  "name": "mybun",
  "created": "1983-04-18T01:02:03.000000004Z",
  "modified": "1983-04-18T01:02:03.000000004Z",
  "parameters": [
    {
      "name": "param_env",
      "source": {
        "env": "PARAM_ENV"
      }
    },
    {
      "name": "param_value",
      "source": {
        "value": "param_value"
      }
    },
    {
      "name": "param_command",
      "source": {
        "command": "echo hello world"
      }
    },
    {
      "name": "param_path",
      "source": {
        "path": "/path/to/param"
      }
    },
    {
      "name": "param_secret",
      "source": {
        "secret": "param_secret"
      }
    }
  ]
}
